

Robin Hartill is a Florida-based Certified Financial Planner and a longtime financial editor and writer. Her work regularly appears on The Motley Fool, Yahoo! Finance and Nerdwallet. Previously, she wrote the syndicated Dear Penny personal finance advice column. She is a graduate of the University of Florida.Tiffany Wendeln Connors is a senior editor for CNET Money with a focus on credit cards. Previously, she covered personal finance topics as a writer and editor at The Penny Hoarder. She is passionate about helping people make the best money decisions for themselves and their families. She graduated from Bowling Green State University with a bachelor's degree in journalism and has been a writer and editor for publications including the New York Post, Women's Running magazine and Soap Opera Digest. When she isn't working, you can find her enjoying life in St. Petersburg, Florida, with her husband, daughter and a very needy dog.Robin Hartill is a Florida-based Certified Financial Planner and a longtime financial editor and writer. Her work regularly appears on The Motley Fool, Yahoo! Finance and Nerdwallet. Previously, she wrote the syndicated Dear Penny personal finance advice column. She is a graduate of the University of Florida.Tiffany Wendeln Connors is a senior editor for CNET Money with a focus on credit cards. Previously, she covered personal finance topics as a writer and editor at The Penny Hoarder. She is passionate about helping people make the best money decisions for themselves and their families. She graduated from Bowling Green State University with a bachelor's degree in journalism and has been a writer and editor for publications including the New York Post, Women's Running magazine and Soap Opera Digest. When she isn't working, you can find her enjoying life in St. Petersburg, Florida, with her husband, daughter and a very needy dog.Sustainable investing is an investment strategy that aims to have a positive impact on the planet and society while also achieving profits. Read on to learn how sustainable investing works, some examples of sustainable investing and how to build a socially responsible investment portfolio.In general, sustainable investing can encompass a wide spectrum of investment activities that range from traditional finance to philanthropy, according to Jeff Finkelman, chartered financial analyst and managing director of sustainable investments at Fiduciary Trust International.It includes simple strategies that seek only to avoid certain industries, such as tobacco or firearms, as well as those that strive to generate positive social or environmental change with investments in renewable energy, affordable housing or any number of other challenging markets in need of capital, he said.Sustainable investors often use negative or exclusionary screening to avoid investing in companies that dont meet certain ESG criteria. Using this approach, an investor may refuse to buy a companys securities if it scores poorly compared with its peers on ESG factors.Some investors choose to exclude entire industries from their portfolios. For example, an investor may avoid sin stocks, generally defined as businesses that many people consider unethical, such as tobacco, alcohol, firearms, gambling and adult entertainment. Or you may refuse to invest in oil or nuclear energy stocks due to their environmental impact or in private prisons out of social concerns.Another approach is to use positive screening, also known as a best-in-class approach. Essentially, this is when investors look for companies and sectors that rank better on ESG factors than their peers. For instance, an investor may choose to invest only in companies that rank above at least 50% of their peers based on a number of preselected criteria.While the terms sustainable investing and ESG investing are often used interchangeably, theyre not quite the same thing. ESG investing is one type of sustainable investing, but there are several other strategies that fall under the sustainable investing umbrella.Impact investing is where you aim to achieve measurable environmental or social goals while also earning financial returns. For example, many communities in the US are considered food deserts, which means they have little access to fresh, healthy food. Investing in a grocery store or restaurant that provides healthy food in one of these communities would be a form of impact investing. The goal is to measurably improve the nutrition of residents, but you also aim to earn a profit on your investment.Another approach is to use thematic funds to invest money in a cause that matters to you. You can find mutual funds and exchange-traded funds that invest around an array of themes, such as womens leadership, clean energy and global health care. You could also invest in individual companies that are proactively working to address issues you care about.One of the big misconceptions about sustainable investing is that its less profitable than other investment approaches. The evidence is mixed, though. Some studies suggest that theres no relationship between sustainability factors and a funds performance, while others conclude that sustainable funds perform at least as well as other funds in their peer group.At the individual company level, theres evidence that adherence to sustainable principles is good for profits. Researchers at New York Universitys Stern School of Business found that sustainability initiatives at corporations are associated with more innovation, and that low carbon strategies were linked to positive financial performance.Sustainable investments may also be less risky than companies that dont have a track record of socially responsible practices. For example, a company with a strong commitment to ESG factors are less likely to be at the center of an environmental disaster, a data breach or a fraud case.Sustainable investing matters because it helps you build wealth in a way that doesnt conflict with your conscience. Many people arent comfortable investing in companies that they believe have a negative impact on the world. With sustainable investing, you can earn profits while avoiding companies that have a poor track record of hurting the environment or violating human rights. You can also proactively invest in companies and projects that are doing good in the world.There were more than 600 mutual funds and ETFs focused on sustainable investments as of 2022, according to US SIF: The Sustainable Investment Forum. Here are just a few examples of sustainable investment funds:You dont have to sacrifice profits to invest sustainably. Whether youre investing in mutual funds or ETFs or individual companies and projects, there are a number of ways to earn profits ethically. You can invest in funds or shares of companies based on whether they adhere to specific ESG criteria, or you can avoid investing in companies whose products and practices conflict with your values. Not only can you feel good about the fact that youre investing with a conscience, but some evidence suggests sustainable investing produces superior returns, particularly in the long run.You can invest sustainably by investing in ESG mutual funds and ETFs or by investing in companies that have strong ESG scores. You can also avoid companies that rank poorly on ESG criteria or that have a history of unethical practices. Some people choose to avoid certain types of companies altogether, such as those that make tobacco or firearms.Sustainable investing is a strategy where you aim to have a positive impact on the world. ESG investing and impact investing are two forms of sustainable investing. ESG investors use environmental, social and governance factors to determine whether an investment is sustainable. Impact investing is a strategy where the focus is achieving a measurable goal that benefits the planet or humanity, in addition to earning positive returns.First, make sure you define your values and what causes you care about, as well as any industries or business practices you consider unethical. If youre interested in mutual funds and ETFs, look for funds that invest according to the themes that matter to you or that screen out investments that conflict with your values. If you want to invest in individual companies, look at ESG ratings from third-party agencies, as well as those that are investing in projects you believe can have a positive long-term impact on the world.The editorial content on this page is based solely on objective, independent assessments by our writers and is not influenced by advertising or partnerships. It has not been provided or commissioned by any third party. However, we may receive compensation when you click on links to products or services offered by our partners.CNET editors independently choose every product and service we cover. Though we cant review every available financial company or offer, we strive to make comprehensive, rigorous comparisons in order to highlight the best of them. For many of these products and services, we earn a commission. The compensation we receive may impact how products and links appear on our site.Writers and editors and produce editorial content with the objective to provide accurate and unbiased information. A separate team is responsible for placing paid links and advertisements, creating a firewall between our affiliate partners and our editorial team. Our editorial team does not receive direct compensation from advertisers.CNET Money is an advertising-supported publisher and comparison service. Were compensated in exchange for placement of sponsored products and services, or when you click on certain links posted on our site. Therefore, this compensation may impact where and in what order affiliate links appear within advertising units. While we strive to provide a wide range of products and services, CNET Money does not include information about every financial or credit product or service.
Chris Sharp is the chief technology officer at Digital Realty, a US business at the intersection of construction and high-tech. It builds data centres, the anonymous warehouses full of computers that keep the online world spinning.Meanwhile, universities, such as the UK's Imperial College London, have for years operated small nuclear reactors for teaching and training purposes. Imperial's own reactor, located just outside London, was operational from 1965 to 2010.Today most companies developing SMRs for commercial use are focusing on helping towns and cities to keep their lights on. However, a clutch of specialist firms have decided that data centres are the best candidates for their SMR designs.In the US, one SMR design from a company called NuScale has already been given the go-ahead by the Office of Nuclear Energy. Meanwhile, in the UK the Office for Nuclear Regulation is continuing to study SMR designs from Rolls-Royce and US tech firm Holtec International.Spencer Lamb, chief commercial officer at British data centre developer Kao Data, doesn't view nuclear-powered facilities in the UK as being something imminent. "I've heard about SMRs, but it will take a long time to deploy a nuclear-configured data centre in the UK, and AI is happening now," he says."People question the viability of nuclear power due to the waste product and risk of an accident," says Mr Gitt. "We recycle the fuel through our reactor multiple times, dealing with the waste, and the new reactors cannot melt-down, they are self-cooling and self-regulating."Mr Gitt declines to reveal if any data centre firms have already signed contracts, but he says that "all the major operators are interested". He adds: "Power is their biggest problem, and they want to deploy this technology within four years, by 2028."So what will a data centre's very own nuclear plant look like? Oklo envisages a large stainless steel tank that contains the SMR dropped into a 50ft (15m) deep hole in the ground. The data centre would then constructed on and around it.
You may have heard that Elon Musks company Neuralink surgically implanted a brain chip in its first human. Dubbed Telepathy, the chip uses neurotechnology in a medical context: It aims to read signals from a paralyzed patients brain and transmit them to a computer, enabling the patient to control it with just their thoughts. In a medical context, neurotech is subject to federal regulations.But researchers are also creating noninvasive neurotech. Already, there are AI-powered brain decoders that can translate into text the unspoken thoughts swirling through our minds, without the need for surgery  although this tech is not yet on the market. In the meantime, you can buy lots of devices off Amazon right now that would record your brain data (like the Muse headband, which uses EEG sensors to read patterns of activity in your brain, then cues you on how to improve your meditation). Since these arent marketed as medical devices, theyre not subject to federal regulations; companies can collect  and sell  your data.With Meta developing a wristband that would read your brainwaves and Apple patenting a future version of AirPods that would scan your brain activity through your ears, we could soon live in a world where companies harvest our neural data just as 23andMe harvests our DNA data. These companies could conceivably build databases with tens of millions of brain scans, which can be used to find out if someone has a disease like epilepsy even when they dont want that information disclosed  and could one day be used to identify individuals against their will.In the US, the action is so far happening on the state level. The Colorado House passed legislation this month that would amend the states privacy law to include the privacy of neural data. Its the first state to take that step. The bill had impressive bipartisan support, though it could still change before its enacted.Minnesota may be next. The state doesnt have a comprehensive privacy law to amend, but its legislature is considering a standalone bill that would protect mental privacy and slap penalties on companies that violate its prohibitions.But preventing a company from harvesting brain data in one state or country is not that useful if it can just do that elsewhere. The holy grail would be federal  or even global  legislation. So, how do we protect mental privacy worldwide?Rafael Yuste, a Columbia University neuroscientist, started to get freaked out by his own neurotech research a dozen years ago. At his lab, employing a method called optogenetics, he found that he could manipulate the visual perception of mice by using a laser to activate specific neurons in the visual cortex of the brain. When he made certain images artificially appear in their brains, the mice behaved as though the images were real. Yuste discovered he could run them like puppets.In 2017, Yuste gathered around 30 experts to meet at Columbias Morningside campus, where they spent days discussing the ethics of neurotech. As Yustes mouse experiments showed, its not just mental privacy thats at stake; theres also the risk of someone using neurotechnology to manipulate our minds. While some brain-computer interfaces only aim to read whats happening in your brain, others also aim to write to the brain  that is, to directly change what your neurons are up to.The group of experts, now known as the Morningside Group, published a Nature paper later that year making four policy recommendations, which Yuste later expanded to five. Think of them as new human rights for the age of neurotechnology:So Yuste connected with Jared Genser, an international human rights lawyer who has represented clients like the Nobel Peace Prize laureates Desmond Tutu and Aung San Suu Kyi. Together, Yuste and Genser created a nonprofit called the Neurorights Foundation to advocate for the cause.They soon notched a major win. In 2021, after Yuste helped craft a constitutional amendment with a close friend who happened to be a Chilean senator, Chile became the first nation to enshrine the right to mental privacy and the right to free will in its national constitution. Mexico, Brazil, and Uruguay are already considering something similar.Ultimately, Yuste wants a new international treaty on neurorights and a new international agency to make sure countries comply with it. He imagines the creation of something like the International Atomic Energy Agency, which monitors the use of nuclear energy. But establishing a new global treaty is probably too ambitious as an opening gambit, so for now, he and Genser are exploring other possibilities.Were not saying that there necessarily need to be new human rights created, Genser told me, explaining that he sees a lot of promise in simply updating current interpretations of human rights law  for example, extending the right to privacy to include mental privacy.Thats relevant both on the international level  hes talking to the UN about updating the provision on privacy that appears in the International Covenant on Civil and Political Rights  and on the national and state levels. While not every nation will amend its constitution, states with a comprehensive privacy law could amend that to cover mental privacy.Thats the path Colorado is taking. If US federal law were to follow Colorado in recognizing neural data as sensitive health data, that data would fall under the protection of HIPAA, which Yuste said would alleviate much of his concern. Another possibility would be to get all neurotech devices recognized as medical devices so they would have to be approved by the FDA.At Vox, we believe that clarity is power, and that power shouldnt only be available to those who can afford to pay. Thats why we keep our work free. Millions rely on Voxs clear, high-quality journalism to understand the forces shaping todays world. Support our mission and help keep Vox free for all by making a financial contribution to Vox today.

